text,etiket
Yutkunmakta zorlanıyorum ve boğazımda sürekli bir gıcık var. Doktorlar bir şey bulamadı ama ben yutkunmakta çok zorlanıyorum. Bu durum yemek yemeyi ve konuşmayı da zorlaştırıyor.,Psikosomatik Bozukluklar
Karnım sürekli ağrıyor ve bazen kramplar giriyor. Mide bulantısı ve ishal de yaşıyorum. Doktorlar herhangi bir sindirim sistemi hastalığı bulamadılar ve stresten kaynaklandığını söylediler.,Psikosomatik Bozukluklar
Son zamanlarda çok sinirliyim ve öfkeliyim. Küçük şeylere bile tahammül edemiyorum ve çabuk sinirleniyorum. Bu durum iş yerinde ve evde problemlere yol açıyor.,Psikosomatik Bozukluklar
Kulaklarımda sürekli bir uğultu var. Doktorlar işitme testi yaptılar ve işitmemde bir sorun olmadığını söylediler. Ama ben bu uğultudan çok rahatsızım. Konsantre olmamı ve uyumamı engelliyor.,Psikosomatik Bozukluklar
 Kendimi değersiz ve işe yaramaz hissediyorum. Sürekli hatalar yapıyorum ve kendimi eleştiriyorum. Başarısız olmaktan çok korkuyorum.,Psikosomatik Bozukluklar
Yemek yeme konusunda çok fazla endişeliyim. Kilo almaktan çok korkuyorum ve sürekli diyet yapıyorum. Bu durum sağlığımı da olumsuz etkiliyor.,Psikosomatik Bozukluklar
 Uykuya dalmakta zorlanıyorum ve geceleri sık sık uyanıyorum. Sabahları da çok yorgun kalkıyorum. Doktorlar herhangi bir uyku apnesi hastalığı bulamadılar ve insomnia teşhisi koydular.,Psikosomatik Bozukluklar
 Bağırsaklarım sürekli gaz yapıyor ve şişiyor. Karnımda da kramplar giriyor. Doktorlar herhangi bir sindirim sistemi hastalığı bulamadılar ve irritabl bağırsak sendromu teşhisi koydular,Psikosomatik Bozukluklar
 Bel ağrım var ama ne zaman başladığını hatırlamıyorum. Her zaman hafif bir sızı şeklinde oluyor ve uzun süre oturunca veya ayakta durunca artıyor. Ağrı kesiciler pek işe yaramıyor ve günlük hayatımı zorlaştırıyor.,Psikosomatik Bozukluklar
 Son zamanlarda baş dönmesi ve bayılma nöbetleri geçiriyorum. Doktorlar kalbimde bir sorun bulamadı ama ben çok korkuyorum. Bu nöbetler her an gelebilir ve ben kendimi güvende hissetmiyorum.,Psikosomatik Bozukluklar
 Eklem ağrılarım var ve özellikle sabahları kalktığımda çok yoğun oluyor. Hareket etmeye başladıkça ağrı hafifliyor ama gün içinde tekrar ediyor. Doktorlar artrit teşhisi koydular ve ilaç verdiler ama ilaçlar ağrıyı tamamen kesmiyor.,Psikosomatik Bozukluklar
" Ciltte kaşıntı, kızarıklık ve kuruluk var. Bazen de döküntüler oluyor. Doktorlar alerji teşhisi koydular ve krem verdiler ama krem kaşıntıyı tam olarak geçirmiyor.",Psikosomatik Bozukluklar
"Vücudumun her yerinde ağrılar var. Baş ağrısı, sırt ağrısı, eklem ağrıları... Doktorlar bir sorun bulamadı ama ben bu ağrılardan kurtulamıyorum. Ağrı kesiciler de işe yaramıyor.",Psikosomatik Bozukluklar
" Son birkaç aydır, sebebini anlayamadığım bir şekilde sürekli kas ağrısı çekiyorum. Ağrı özellikle geceleri şiddetleniyor ve uyumamı engelliyor. Doktorlar herhangi bir fiziksel neden bulamadılar ve ağrının stresten kaynaklandığını söylediler.",Psikosomatik Bozukluklar
 Vücudumun görünümünden hiç memnun değilim. Sürekli kendimi başkalarıyla karşılaştırıyorum ve kendimi çirkin buluyorum. Bu durum özgüvenimi de zedeliyor.,Psikosomatik Bozukluklar
 Kendimi çok yalnız ve çaresiz hissediyorum. Kimseden destek alamıyorum ve her şeyi tek başıma yapmak zorundaymışım gibi hissediyorum. Bu durum beni daha da depresif yapıyor.,Psikosomatik Bozukluklar
 Ellerim ve ayaklarım sürekli uyuşuyor ve karıncalanıyor. Dokunma duyum da azaldı. Doktorlar herhangi bir sinir sistemi hastalığı bulamadılar ve karpal tünel sendromu teşhisi koydular.,Psikosomatik Bozukluklar
 Nefes almakta zorlanıyorum ve göğsümde sıkışma hissediyorum. Doktorlar akciğerlerimde bir sorun bulamadı ama ben nefes darlığı yaşıyorum. Bu durum yürüyüş yapmaktan ve merdiven çıkmaktan bile beni alıkoyuyor.,Psikosomatik Bozukluklar
" Başım sürekli ağrıyor, doktorlar çözüm bulamadı.",Psikosomatik Bozukluklar
 Kendimi sürekli yorgun ve bitkin hissediyorum. Uyku düzenim normal olmasına rağmen dinlenemiyorum. Bu durum işimi ve sosyal hayatımı da etkiliyor.,Psikosomatik Bozukluklar
 Başım sürekli zonkluyor sanki bir çekiçle vuruluyormuş gibi. Ağrı bazen o kadar şiddetli oluyor ki işimi yapamıyorum veya konsantre olamıyorum. Doktorlar migren teşhisi koydular ve ilaç verdiler ama ilaçlar her zaman işe yaramıyor.,Psikosomatik Bozukluklar
Kendimi sürekli endişeli ve gergin hissediyorum. Hiç rahatlayamıyorum ve sakin olamıyorum. Bu durum uyku problemlerine de yol açıyor.,Psikosomatik Bozukluklar
 Göğsümde sürekli bir sıkışma ve baskı hissi var. Nefes almamda zorlanıyorum ve kalbim çarpıyormuş gibi hissediyorum. Doktorlar herhangi bir kalp hastalığı bulamadılar ve panik atak teşhisi koydular.,Psikosomatik Bozukluklar
 Son zamanlarda hafızam çok zayıfladı. Bir şeyleri unutmaya başladım ve konsantre olmakta zorlanıyorum. Dikkatim çok çabuk dağılıyor ve kafam çok karışık.,Psikosomatik Bozukluklar
 Ellerim ve ayaklarım sürekli uyuşuyor ve karıncalanıyor. Doktorlar sinir sistemimde bir sorun bulamadı ama ben bu durumdan çok rahatsızım. Uyuşma ve karıncalanma nöbetleri gece de oluyor ve uyumamı engelliyor.,Psikosomatik Bozukluklar
Yutkunmakta zorlanıyorum ve boğazımda bir yumru varmış gibi hissediyorum. Doktorlar herhangi bir boğaz hastalığı bulamadılar ve anksiyeteden kaynaklandığını söylediler.,Psikosomatik Bozukluklar
 Hiçbir şeyden zevk almıyorum. Eskiden sevdiğim şeyleri yapmak artık bana keyif vermiyor. Kendimi mutsuz ve isteksiz hissediyorum.,Psikosomatik Bozukluklar
 Dişlerim sürekli ağrıyor ve sızlıyor. Doktorlar herhangi bir diş çürüğü veya diş eti hastalığı bulamadılar ve bruksizm teşhisi koydular.,Psikosomatik Bozukluklar
 Kulaklarımda sürekli bir uğultu var ve bu ses beni çok rahatsız ediyor. Konsantre olmamı ve uyumamı engelliyor. Doktorlar herhangi bir işitme kaybı bulamadılar ve tinnitus teşhisi koydular.,Psikosomatik Bozukluklar
 Vücudumun her yerinde kas gerginliği ve hassasiyet hissediyorum. Dokunmaya bile tahammül edemiyorum. Doktorlar fibromiyalji teşhisi koydular ve ilaç verdiler ama ilaçlar kas ağrılarımı tam olarak geçirmiyor.,Psikosomatik Bozukluklar
 Çok stresli olduğum dönemlerde egzamam çıkıyor. Doktor doktor gezdim ama çözüm bulamadılar. Beni psikoloğa yönlendirdiler.,Psikosomatik Bozukluklar
Sırtımda sürekli bir yanma ve batma hissi var. Ağrı bazen o kadar şiddetli oluyor ki nefes almamı zorlaştırıyor. Doktorlar herhangi bir fiziksel neden bulamadılar ve nevralji teşhisi koydular.,Psikosomatik Bozukluklar
"Son zamanlarda mide bulantısı, kusma ve karın ağrısı yaşıyorum. Doktorlar bir şey bulamadı ama ben kendimi gerçekten hasta hissediyorum. Bu durum işimi ve aile hayatımı da etkiliyor.",Psikosomatik Bozukluklar
Başım dönüyor ve dengemi kaybediyormuş gibi hissediyorum. Bazen düşecekmiş gibi oluyorum. Doktorlar herhangi bir iç kulak sorunu bulamadılar ve vertigo teşhisi koydular.,Psikosomatik Bozukluklar
Midemde sürekli bir yanma ve ekşime hissi var. Bazen de kusma oluyor. Doktorlar gastrit teşhisi koydular ve ilaç verdiler ama ilaçlar her zaman işe yaramıyor.,Psikosomatik Bozukluklar
Ciltte döküntü ve kaşıntı var. Doktorlar alerji testi yaptılar ama alerjim yokmuş. Kaşıntı o kadar şiddetli ki geceleri uyuyamıyorum ve cildim tahriş oluyor.,Psikosomatik Bozukluklar
Yutkunmakta zorlanıyorum ve boğazımda sürekli bir gıcık var. Doktorlar bir şey bulamadı ama ben yutkunmakta çok zorlanıyorum. Bu durum yemek yemeyi ve konuşmayı da zorlaştırıyor.,Psikosomatik Bozukluklar
Karnım sürekli ağrıyor ve bazen kramplar giriyor. Mide bulantısı ve ishal de yaşıyorum. Doktorlar herhangi bir sindirim sistemi hastalığı bulamadılar ve stresten kaynaklandığını söylediler.,Psikosomatik Bozukluklar
Kulaklarımda sürekli bir uğultu var. Doktorlar işitme testi yaptılar ve işitmemde bir sorun olmadığını söylediler. Ama ben bu uğultudan çok rahatsızım. Konsantre olmamı ve uyumamı engelliyor.,Psikosomatik Bozukluklar
Yemek yeme konusunda çok fazla endişeliyim. Kilo almaktan çok korkuyorum ve sürekli diyet yapıyorum. Bu durum sağlığımı da olumsuz etkiliyor.,Psikosomatik Bozukluklar
Uykuya dalmakta zorlanıyorum ve geceleri sık sık uyanıyorum. Sabahları da çok yorgun kalkıyorum. Doktorlar herhangi bir uyku apnesi hastalığı bulamadılar ve insomnia teşhisi koydular.,Psikosomatik Bozukluklar
Bağırsaklarım sürekli gaz yapıyor ve şişiyor. Karnımda da kramplar giriyor. Doktorlar herhangi bir sindirim sistemi hastalığı bulamadılar ve irritabl bağırsak sendromu teşhisi koydular.,Psikosomatik Bozukluklar
Bel ağrım var ama ne zaman başladığını hatırlamıyorum. Her zaman hafif bir sızı şeklinde oluyor ve uzun süre oturunca veya ayakta durunca artıyor. Ağrı kesiciler pek işe yaramıyor ve günlük hayatımı zorlaştırıyor.,Psikosomatik Bozukluklar
Son zamanlarda baş dönmesi ve bayılma nöbetleri geçiriyorum. Doktorlar kalbimde bir sorun bulamadı ama ben çok korkuyorum. Bu nöbetler her an gelebilir ve ben kendimi güvende hissetmiyorum.,Psikosomatik Bozukluklar
Eklem ağrılarım var ve özellikle sabahları kalktığımda çok yoğun oluyor. Hareket etmeye başladıkça ağrı hafifliyor ama gün içinde tekrar ediyor. Doktorlar artrit teşhisi koydular ve ilaç verdiler ama ilaçlar ağrıyı tamamen kesmiyor.,Psikosomatik Bozukluklar
"Vücudumun her yerinde ağrılar var. Baş ağrısı, sırt ağrısı, eklem ağrıları... Doktorlar bir sorun bulamadı ama ben bu ağrılardan kurtulamıyorum. Ağrı kesiciler de işe yaramıyor.",Psikosomatik Bozukluklar
"Son birkaç aydır, sebebini anlayamadığım bir şekilde sürekli kas ağrısı çekiyorum. Ağrı özellikle geceleri şiddetleniyor ve uyumamı engelliyor. Doktorlar herhangi bir fiziksel neden bulamadılar ve ağrının stresten kaynaklandığını söylediler.",Psikosomatik Bozukluklar
Ellerim ve ayaklarım sürekli uyuşuyor ve karıncalanıyor. Dokunma duyum da azaldı. Doktorlar herhangi bir sinir sistemi hastalığı bulamadılar ve karpal tünel sendromu teşhisi koydular.,Psikosomatik Bozukluklar
Nefes almakta zorlanıyorum ve göğsümde sıkışma hissediyorum. Doktorlar akciğerlerimde bir sorun bulamadı ama ben nefes darlığı yaşıyorum. Bu durum yürüyüş yapmaktan ve merdiven çıkmaktan bile beni alıkoyuyor.,Psikosomatik Bozukluklar
"Başım sürekli ağrıyor, doktorlar çözüm bulamadı.",Psikosomatik Bozukluklar
Kendimi sürekli yorgun ve bitkin hissediyorum. Uyku düzenim normal olmasına rağmen dinlenemiyorum. Bu durum işimi ve sosyal hayatımı da etkiliyor.,Psikosomatik Bozukluklar
Başım sürekli zonkluyor sanki bir çekiçle vuruluyormuş gibi. Ağrı bazen o kadar şiddetli oluyor ki işimi yapamıyorum veya konsantre olamıyorum. Doktorlar migren teşhisi koydular ve ilaç verdiler ama ilaçlar her zaman işe yaramıyor.,Psikosomatik Bozukluklar
Göğsümde sürekli bir sıkışma ve baskı hissi var. Nefes almamda zorlanıyorum ve kalbim çarpıyormuş gibi hissediyorum. Doktorlar herhangi bir kalp hastalığı bulamadılar ve panik atak teşhisi koydular.,Psikosomatik Bozukluklar
Yutkunmakta zorlanıyorum ve boğazımda bir yumru varmış gibi hissediyorum. Doktorlar herhangi bir boğaz hastalığı bulamadılar ve anksiyeteden kaynaklandığını söylediler.,Psikosomatik Bozukluklar
Dişlerim sürekli ağrıyor ve sızlıyor. Doktorlar herhangi bir diş çürüğü veya diş eti hastalığı bulamadılar ve bruksizm teşhisi koydular.,Psikosomatik Bozukluklar
Kulaklarımda sürekli bir uğultu var ve bu ses beni çok rahatsız ediyor. Konsantre olmamı ve uyumamı engelliyor. Doktorlar herhangi bir işitme kaybı bulamadılar ve tinnitus teşhisi koydular.,Psikosomatik Bozukluklar
Vücudumun her yerinde kas gerginliği ve hassasiyet hissediyorum. Dokunmaya bile tahammül edemiyorum. Doktorlar fibromiyalji teşhisi koydular ve ilaç verdiler ama ilaçlar kas ağrılarımı tam olarak geçirmiyor.,Psikosomatik Bozukluklar
Gözlerim sürekli seğiriyor ve sanki bir kum tanesi varmış gibi kaşınıyor. Doktorlar gözlerimde bir sorun bulamadı.,Psikosomatik Bozukluklar
"Sürekli baş ağrısı çekiyorum, özellikle şakaklarımda bir baskı hissediyorum. Ağrı kesiciler sadece kısa süreliğine fayda sağlıyor.",Psikosomatik Bozukluklar
"Nefes alırken ciğerlerimde bir ağırlık ve baskı hissediyorum. Bu durum, özellikle kalabalık ortamlarda artıyor. Doktorlar astım veya KOAH gibi bir hastalık bulamadılar.",Psikosomatik Bozukluklar
Ayaklarımda sürekli bir üşüme ve karıncalanma hissi var. Kış aylarında çorap giymeme rağmen geçmiyor. Doktorlar dolaşım problemim olmadığını söyledi.,Psikosomatik Bozukluklar
"Boynumda ve omuzlarımda sürekli bir gerginlik ve sertlik hissediyorum. Bu durum, özellikle uzun süre bilgisayar başında çalıştığımda artıyor.",Psikosomatik Bozukluklar
Sol kolumda zaman zaman uyuşma ve karıncalanma oluyor. Kalp krizi geçireceğimden çok korkuyorum ama doktorlar bir şey bulamadı.,Psikosomatik Bozukluklar
Midem sürekli kasılıyor ve hazımsızlık çekiyorum. Yediklerim midemde bir top gibi kalıyor gibi hissediyorum.,Psikosomatik Bozukluklar
"Yüzümde, özellikle yanaklarımda ve alnımda kızarıklıklar ve yanma hissi oluyor. Cilt doktorları alerji olmadığını söyledi.",Psikosomatik Bozukluklar
Sürekli idrara çıkma ihtiyacı hissediyorum. Doktorlar mesanemde bir sorun olmadığını söyledi.,Psikosomatik Bozukluklar
Vücudumda aniden ortaya çıkan ve bir süre sonra kaybolan morarmalar oluyor. Doktorlar kan değerlerimin normal olduğunu söylüyor.,Psikosomatik Bozukluklar
Yüzümün sağ tarafında zaman zaman ani ve keskin bir ağrı hissediyorum. Nevralji olabileceği söylendi ama ilaçlar pek işe yaramıyor.,Psikosomatik Bozukluklar
Görme yeteneğimde zaman zaman bulanıklık ve çift görme oluyor. Göz doktoru gözlerimde bir sorun olmadığını söyledi.,Psikosomatik Bozukluklar
Saçlarım son zamanlarda çok fazla dökülüyor. Dermatologlar bir hastalık bulamadı ve strese bağladı.,Psikosomatik Bozukluklar
"Ellerim sürekli titriyor, özellikle birine bir şey uzatırken çok utanıyorum.",Psikosomatik Bozukluklar
"Sürekli terliyorum, özellikle de stresli olduğum zamanlarda. Koltuk altlarım ve ellerim çok fazla terliyor.",Psikosomatik Bozukluklar
"Yemek yerken yutkunmakta zorlanıyorum, boğazımda bir şey takılmış gibi hissediyorum.",Psikosomatik Bozukluklar
"Ağzımda metalik bir tat var, özellikle sabahları çok yoğun oluyor.",Psikosomatik Bozukluklar
"Diş etlerim sürekli kanıyor, diş doktoru diş etlerimin sağlıklı olduğunu söyledi.",Psikosomatik Bozukluklar
"Boynumda ve boğazımda sürekli bir gerginlik hissediyorum, sanki biri beni boğuyormuş gibi.",Psikosomatik Bozukluklar
"Sağ bacağımda aniden gelen kramplar oluyor, özellikle geceleri uyandırıyor.",Psikosomatik Bozukluklar
"Sol göğsümde hafif bir ağrı ve baskı hissediyorum. Bu, panik atak sırasında daha da şiddetleniyor.",Psikosomatik Bozukluklar
"Ellerim ve ayaklarım sürekli soğuk, kış aylarında kan dolaşımım durmuş gibi hissediyorum.",Psikosomatik Bozukluklar
"Karnımda sürekli bir şişkinlik ve gaz var, bu durum sosyal hayatımı çok etkiliyor.",Psikosomatik Bozukluklar
Yüzümün sağ tarafında ani bir uyuşma ve hissizlik oluyor.,Psikosomatik Bozukluklar
"Sırtımda, kürek kemiklerimin arasında sürekli bir ağrı ve kasılma hissediyorum.",Psikosomatik Bozukluklar
Bacaklarımda ve kollarımda zaman zaman kontrolsüz seğirmeler oluyor.,Psikosomatik Bozukluklar
"Vücudumun her yerinde, özellikle de sırtımda ve omuzlarımda sürekli bir kaşıntı var.",Psikosomatik Bozukluklar
Çok sık idrara çıkıyorum ama idrar yaparken yanma hissi olmuyor. Doktorlar bir şey bulamadı.,Psikosomatik Bozukluklar
Göz kapaklarımda sürekli bir titreme ve seğirme var.,Psikosomatik Bozukluklar
"Ağzım sürekli kuruyor, su içsem de geçmiyor.",Psikosomatik Bozukluklar
"Boğazımda sürekli bir yumru hissi var, yutkunmakta zorlanıyorum.",Psikosomatik Bozukluklar
Saç derimde sürekli bir kaşıntı ve yanma hissi var.,Psikosomatik Bozukluklar
"Ayaklarımın altı sürekli yanıyor, özellikle geceleri beni uyutmaktan alıkoyuyor.",Psikosomatik Bozukluklar
"Sol kolumda aniden bir ağrı ve uyuşma oluyor, panik yapmama neden oluyor.",Psikosomatik Bozukluklar
Mide bulantım oluyor ama kusmuyorum. Bu his sürekli ve rahatsız edici.,Psikosomatik Bozukluklar
"Sürekli hafif ateş basması yaşıyorum, özellikle stresli anlarda.",Psikosomatik Bozukluklar
"Bacaklarımda ve kollarımda uyuşma hissi var, sanki karıncalar yürüyor gibi.",Psikosomatik Bozukluklar
Yüzümde aniden ortaya çıkan ve kaybolan kaşıntılı kızarıklıklar var.,Psikosomatik Bozukluklar
"Sürekli bir baş dönmesi hissiyle uyanıyorum, bazen ayakta durmakta zorlanıyorum.",Psikosomatik Bozukluklar
Yemek yedikten sonra midemde bir taş varmış gibi hissediyorum.,Psikosomatik Bozukluklar
"Sol göğsümde bir batma hissi var, bu durum beni kalp krizi geçirme korkusuyla yaşıyor.",Psikosomatik Bozukluklar
Sık sık nefes darlığı çekiyorum ve derin nefes alamıyorum.,Psikosomatik Bozukluklar
Geceleri dişlerimi sıkmaktan çene kaslarım çok ağrıyor.,Psikosomatik Bozukluklar
"Vücudumun bazı bölgelerinde, özellikle boynumda ve omuzlarımda, kaslarımda sürekli bir gerginlik hissediyorum.",Psikosomatik Bozukluklar
"Ellerde ve ayaklarda sürekli bir uyuşukluk hissi var, dokunma duyum azaldı.",Psikosomatik Bozukluklar
Karnımda sürekli bir şişkinlik ve guruldama sesi var.,Psikosomatik Bozukluklar
Son zamanlarda çok sinirliyim ve öfkeliyim. Küçük şeylere bile tahammül edemiyorum ve çabuk sinirleniyorum. Bu durum iş yerinde ve evde problemlere yol açıyor.,Psikosomatik Bozukluklar
Kendimi değersiz ve işe yaramaz hissediyorum. Sürekli hatalar yapıyorum ve kendimi eleştiriyorum. Başarısız olmaktan çok korkuyorum.,Psikosomatik Bozukluklar
Vücudumun görünümünden hiç memnun değilim. Sürekli kendimi başkalarıyla karşılaştırıyorum ve kendimi çirkin buluyorum. Bu durum özgüvenimi de zedeliyor.,Psikosomatik Bozukluklar
Kendimi çok yalnız ve çaresiz hissediyorum. Kimseden destek alamıyorum ve her şeyi tek başıma yapmak zorundaymışım gibi hissediyorum. Bu durum beni daha da depresif yapıyor.,Psikosomatik Bozukluklar
Kendimi sürekli endişeli ve gergin hissediyorum. Hiç rahatlayamıyorum ve sakin olamıyorum. Bu durum uyku problemlerine de yol açıyor.,Psikosomatik Bozukluklar
Son zamanlarda hafızam çok zayıfladı. Bir şeyleri unutmaya başladım ve konsantre olmakta zorlanıyorum. Dikkatim çok çabuk dağılıyor ve kafam çok karışık.,Psikosomatik Bozukluklar
Hiçbir şeyden zevk almıyorum. Eskiden sevdiğim şeyleri yapmak artık bana keyif vermiyor. Kendimi mutsuz ve isteksiz hissediyorum.,Psikosomatik Bozukluklar
Kendimi sürekli yorgun ve bitkin hissediyorum. Uyku düzenim normal olmasına rağmen dinlenemiyorum. Bu durum işimi ve sosyal hayatımı da etkiliyor.,Psikosomatik Bozukluklar
Kendimi çok sık ağlarken buluyorum ve nedenini bilmiyorum.,Psikosomatik Bozukluklar
Her an kötü bir şey olacakmış gibi hissediyorum ve sürekli tetikteyim.,Psikosomatik Bozukluklar
Sosyal ortamlardan kaçınıyorum ve insanlarla konuşmaktan çekiniyorum.,Psikosomatik Bozukluklar
"Çok fazla yemek yiyorum ya da hiç yemiyorum, iştahım kontrolsüz.",Psikosomatik Bozukluklar
Sürekli gelecekle ilgili endişelerim var ve sürekli en kötü senaryoları düşünüyorum.,Psikosomatik Bozukluklar
Kendimi hiç kimsenin anlamadığını hissediyorum.,Psikosomatik Bozukluklar
"Gece yattığımda zihnim durmuyor, sürekli düşüncelerle boğuşuyorum.",Psikosomatik Bozukluklar
Küçük bir başarısızlıkta bile dünyam yıkılıyor gibi hissediyorum.,Psikosomatik Bozukluklar
"Karar vermek benim için çok zor, basit konularda bile tereddüt yaşıyorum.",Psikosomatik Bozukluklar
Kendimi sürekli başkalarıyla karşılaştırıyorum ve yetersiz hissediyorum.,Psikosomatik Bozukluklar
Geçmişteki hatalarımı sürekli düşünüyorum ve kendimi affedemiyorum.,Psikosomatik Bozukluklar
"Kimseden destek istemekten utanıyorum, her şeyi tek başıma çözmeliyim gibi hissediyorum.",Psikosomatik Bozukluklar
Çok çabuk sinirleniyorum ve bu beni çok rahatsız ediyor.,Psikosomatik Bozukluklar
Kendimi sürekli bir şeyleri kanıtlamak zorunda hissediyorum.,Psikosomatik Bozukluklar
Birileri bana yardım etmek istediğinde rahatsız oluyorum ve geri çeviriyorum.,Psikosomatik Bozukluklar
Başkalarının benim hakkımda ne düşündüğünü çok fazla önemsiyorum.,Psikosomatik Bozukluklar
En ufak bir eleştiride bile çok fazla kırılıyorum ve kendime çekiliyorum.,Psikosomatik Bozukluklar
İnsanlarla göz teması kurmaktan çekiniyorum.,Psikosomatik Bozukluklar
Kendimi sürekli bir çıkmazda hissediyorum ve hiçbir şeyin değişmeyeceğini düşünüyorum.,Psikosomatik Bozukluklar
Yeni bir şeye başlamaktan korkuyorum çünkü başarısız olacağımı düşünüyorum.,Psikosomatik Bozukluklar
"Başarılarımın tadını çıkaramıyorum, hep bir sonraki endişem başlıyor.",Psikosomatik Bozukluklar
"Gelecekle ilgili hiçbir plan yapamıyorum, çünkü her an her şeyin kötüye gideceğini düşünüyorum.",Psikosomatik Bozukluklar
Kendimi fiziksel olarak çok kısıtlanmış hissediyorum.,Psikosomatik Bozukluklar
"Bir yere giderken, ya da bir şey yaparken sürekli başıma kötü bir şey geleceği korkusuyla yaşıyorum.",Psikosomatik Bozukluklar
"Gece uykusuz kaldığımda gündüz uykum gelmiyor, sadece yorgun hissediyorum.",Psikosomatik Bozukluklar
Kendi kendime konuşuyorum ve bazen bu beni korkutuyor.,Psikosomatik Bozukluklar
"Bir şeyleri düşünürken o kadar çok dalıp gidiyorum ki, çevremdeki hiçbir şeyi fark etmiyorum.",Psikosomatik Bozukluklar
"Bazen o kadar durgun ve yavaş hissediyorum ki, sanki vücudum bana ait değil.",Psikosomatik Bozukluklar
"Sürekli bir huzursuzluk hissiyle dolaşıyorum, sanki yerimde duramıyorum.",Psikosomatik Bozukluklar
Çok fazla takıntım var ve bu beni çok yoruyor.,Psikosomatik Bozukluklar
Kendimi sürekli bir şeyleri temizlemek ve düzenlemek zorunda hissediyorum.,Psikosomatik Bozukluklar
Bir şeyin eksik veya yanlış olduğunu düşündüğümde defalarca kontrol etme ihtiyacı duyuyorum.,Psikosomatik Bozukluklar
İnsanlarla konuşurken sürekli yanlış bir şey söyleyeceğimden korkuyorum.,Psikosomatik Bozukluklar
"Toplu taşıma araçlarına binmekten, kapalı ve kalabalık yerlerde bulunmaktan korkuyorum.",Psikosomatik Bozukluklar
Çok önemli bir sınav veya görüşme öncesinde midemde bir kramp hissediyorum.,Psikosomatik Bozukluklar
Bazen hiçbir şeyin gerçek olmadığı hissine kapılıyorum.,Psikosomatik Bozukluklar
Bir an önce evden çıkmak istiyorum ama dışarıda beni nelerin beklediğini bilmek beni korkutuyor.,Psikosomatik Bozukluklar
Birisi bana dokunduğunda geriliyorum.,Psikosomatik Bozukluklar
"Biri bana soru sorduğunda, ne diyeceğimi bilemiyorum ve kekeliyorum.",Psikosomatik Bozukluklar
Uykumda sürekli kabuslar görüyorum ve bu beni çok yoruyor.,Psikosomatik Bozukluklar
"Bazen o kadar çok düşünüyorum ki, sanki beynim patlayacak gibi hissediyorum.",Psikosomatik Bozukluklar
"Kendimi sürekli bir boşlukta hissediyorum, sanki hiçbir şeyin anlamı yok.",Psikosomatik Bozukluklar
Sürekli mide ağrım var ama doktorlar fiziksel bir neden bulamıyor.,Psikosomatik Bozukluklar
Başım ağrıyor ama bu ağrının stresli zamanlarda arttığını fark ettim.,Psikosomatik Bozukluklar
"Nefes almakta zorlanıyorum, ama kalp ve akciğer testlerim temiz çıktı.",Psikosomatik Bozukluklar
"Göğsümde bir baskı hissi var, ama doktorlar bunun psikolojik olabileceğini söylüyor.",Psikosomatik Bozukluklar
Her sabah kalktığımda vücudumda ağrılar hissediyorum ama tıbbi bir teşhis konmadı.,Psikosomatik Bozukluklar
Kalbim sıkışıyor gibi oluyor ama kalp sağlığımda bir sorun yokmuş.,Psikosomatik Bozukluklar
Ellerimde titreme oluyor ama nörolojik testlerim normal çıktı.,Psikosomatik Bozukluklar
"Karnımda sürekli bir gerginlik hissi var, özellikle kaygılı olduğumda artıyor.",Psikosomatik Bozukluklar
Doktorlar hiçbir şey bulamıyor ama ben gerçekten fiziksel olarak hasta gibi hissediyorum.,Psikosomatik Bozukluklar
Boğazımda düğümlenme hissi yaşıyorum ama boğazımda fiziksel bir sorun yok.,Psikosomatik Bozukluklar
"Kaslarımda ağrı ve yorgunluk hissediyorum, ancak kan testlerimde her şey normal.",Psikosomatik Bozukluklar
"Ağzım kuruyor ve yutkunmakta zorlanıyorum, ama bunun bir nedeni bulunamadı.",Psikosomatik Bozukluklar
Gözlerim sık sık kararıyor ama doktorlar gözlerimde bir sorun olmadığını söylüyor.,Psikosomatik Bozukluklar
"Kulağımda uğultular var, özellikle stresliyken daha belirginleşiyor.",Psikosomatik Bozukluklar
Bazen bacaklarımda karıncalanma hissediyorum ama nörolojik muayeneler temiz çıktı.,Psikosomatik Bozukluklar
"Karın şişkinliği yaşıyorum, ama yapılan testlerde bağırsaklarımda bir sorun yok.",Psikosomatik Bozukluklar
Yemek yerken midem bulanıyor ama fiziksel bir mide sorunum yok.,Psikosomatik Bozukluklar
Vücudumda sanki iğneler batıyormuş gibi hissediyorum ama herhangi bir deri hastalığım yok.,Psikosomatik Bozukluklar
Çarpıntı yaşıyorum ama kalp testlerim tamamen normal.,Psikosomatik Bozukluklar
